College_Name,State,Stream,UG_fee,PG_fee,Rating,Academic,Accommodation,Faculty,Infrastructure,Placement,Social_Life
"University School Of Law, Gujarat University",Gujarat,Law,654,670,7.9,8.2,7.4,8.2,8,7.5,8.1
Maharaja Sayajirao University Of Baroda,Gujarat,Law,654,670,7.9,8.3,7,8.4,8,7.2,8.4
Dr Babasaheb Ambedkar Open University,Gujarat,Law,654,670,7.7,8.5,5.5,8.5,8,7.5,8.1
Navrachana University,Gujarat,Law,654,670,7.7,7.7,7.4,8.2,8,7.2,7.8
Sardar Patel University,Gujarat,Law,654,670,7.8,8.6,7,8.5,7.7,7.3,7.8
"Vt Choksi Sarvajanik Law College, Surat",Gujarat,Law,654,670,5.8,8,8,6,7,1,5
Anand Law College,Gujarat,Law,654,670,7,6.5,7.5,6.5,6.5,6.5,8.5
Gujarat Vidyapith,Gujarat,Law,654,670,8.4,9,7.9,9.1,8.4,7.6,8.1
"Gls University, Ahmedabad",Gujarat,Law,654,670,7.9,8,6.9,8.5,8.1,7.6,8.5
Indian School Of Business Management And Administration,Gujarat,Law,654,670,8,8.8,7.6,8.1,8,7.9,7.8
"Auro University, Surat",Gujarat,Law,654,670,8.3,8.2,8.5,8.6,8.7,7.2,8.6
"Atmiya University, Rajkot",Gujarat,Law,654,670,8.1,8.8,7.5,8.6,8.4,7.4,7.9
Ganpat University,Gujarat,Law,654,670,8.1,8.2,7.2,8.1,8.5,7.8,8.6
"C. U. Shah University, Wadhwan",Gujarat,Law,654,670,7.7,7.6,7,8.2,7.8,7.4,7.9
"Indus University, Ahmedabad",Gujarat,Law,654,670,7.5,7.9,7,7.7,7.8,6.8,7.9
Marwadi University,Gujarat,Law,654,670,8.3,8.2,8.3,8.2,9.1,7.7,8.2
"Daulatbhai Trivedi Law College, Ahmedabad",Gujarat,Law,654,670,7.9,8.5,8,8.5,8,6.5,8
Adani Institute Of Infrastructure Management,Gujarat,Law,654,670,8.1,7.9,8.1,8.3,9.3,7.9,6.9
Gokul Global University,Gujarat,Law,654,670,8.5,9,7,9.3,8.7,8,8.7
"Khyati Foundation, Ahmedabad",Gujarat,Law,654,670,9.2,9.3,9,9.3,9.5,8.8,9
Bk Majumdar Institute Of Business Administration,Gujarat,Law,654,670,8.3,8.8,7.8,8.4,9,7.6,8.4
Bapu Gujarat Knowledge Village,Gujarat,Law,654,670,7.9,8.2,7.4,8.2,8,7.5,8.1
Lj University,Gujarat,Law,654,670,8,8.8,7,8.3,8.8,8,7
Rajiv Gandhi National University Of Law,Punjab,Law,654,670,7.7,7.6,7.3,7.2,9.4,6.3,8.2
Army Institute Of Law,Punjab,Law,654,670,7.8,7.5,8.5,7,7.7,7.6,8.7
"Department Of Laws Panjab University, Chandigarh",Punjab,Law,654,670,7.9,8.2,7.4,8.2,8,7.5,8.1
Panjab University,Punjab,Law,654,670,7.7,8.2,7.7,8,7.7,6.5,8.2
Chandigarh University,Punjab,Law,654,670,8.6,8.6,8.2,8.4,9,8.6,8.8
"University Institute Of Legal Studies, Panjab University,",Punjab,Law,654,670,7.7,8.6,7,8.4,7.4,6.5,8.3
Baba Kundan Singh Memorial Law College,Punjab,Law,654,670,7.9,8.2,7.4,8.2,8,7.5,8.1
Goswami Ganesh Dutt Sanatan Dharama College,Punjab,Law,654,670,8.1,8.6,7.6,8.5,8.1,7.1,8.8
"Rimt University, Gobindgarh",Punjab,Law,654,670,7.6,7.9,7.3,7.8,8,6.7,7.8
"Guru Kashi University, Bathinda",Punjab,Law,654,670,7.5,7.4,7.2,8,7.2,7.2,7.8
"Dav University, Jalandhar",Punjab,Law,654,670,7.9,8.4,7,8.4,7,8,8.5
Sant Baba Bhag Singh University,Punjab,Law,654,670,8.5,9,8.2,8.6,8,8.5,8.6
"Rayat Bahra University, Mohali",Punjab,Law,654,670,7.7,7.8,7.4,8,7.7,7.4,7.6
Sri Guru Granth Sahib World University,Punjab,Law,654,670,8.8,8.6,9,9,9.1,8.4,8.7
Amritsar Group Of Colleges,Punjab,Law,654,670,8.8,8.7,8.9,9,8.8,8.6,9
"Ct Group Of Institutions, Jalandhar",Punjab,Law,654,670,7.6,7.5,7,8.2,7.5,7.9,7.4
"Aryans Group Of Colleges, Rajpura",Punjab,Law,654,670,7.5,7.6,7,7.9,7.6,7.3,7.6
"Rayat Bahra Hoshiarpur Campus, Hoshiarpur",Punjab,Law,654,670,8.9,9.2,8.5,9.2,8.3,8.8,9.1
P.U. Swami Sarvanand Giri Regional Centre,Punjab,Law,654,670,6.5,6.6,7.4,6.1,6.5,5.5,7
"Rayat Bahra Patiala Campus, Patiala",Punjab,Law,654,670,6,6.3,7.8,6,6,4,6
"Rayat Bahra Group Of Institutions: Ropar Campus,",Punjab,Law,654,670,6.7,6.5,8,7.5,7,5,6
"Guru Nanak Dev University Regional Campus, Gurdaspur",Punjab,Law,654,670,6.3,6.9,6.6,6,6.3,6,5.8
Universal Group Of Institutions,Punjab,Law,654,670,7.8,7.3,7.2,7.9,8.3,7.9,8.1
"University School Of Management Studies, Rayat Bahra",Punjab,Law,654,670,7.9,8.2,7.4,8.2,8,7.5,8.1
"Guru Nanak Khalsa College, Kapurthala",Punjab,Law,654,670,7.9,8.2,7.4,8.2,8,7.5,8.1
Hans Raj Mahila Maha Vidyalaya,Punjab,Law,654,670,8.2,8.4,8,8.4,8.7,7.3,8.3
"Baba Farid Law College, Faridkot",Punjab,Law,654,670,5.2,6.3,4.8,6.2,5.3,3.6,4.8
Indian Institute Of Technology,West Bengal,Law,654,670,8.5,8.8,7.2,8.2,8.9,8.8,9
The West Bengal National University Of Juridical,West Bengal,Law,654,670,8.5,8.6,8.2,8.7,6.8,9.2,9.4
"Faculty Of Law University Of Calcutta, Kolkata",West Bengal,Law,654,670,7.3,8.5,6.2,8.2,7.2,6.5,7
"South Calcutta Law College, Kolkata",West Bengal,Law,654,670,7.2,8.4,6,8,7.9,5.4,7.7
Bengal Institute Of Technology And Management,West Bengal,Law,654,670,6.7,6.7,6.2,7.2,6.8,6.3,7
"University Of Calcutta, Kolkata",West Bengal,Law,654,670,7.7,8.6,6.9,8.5,7.7,6.5,7.7
St. Xavier'S College,West Bengal,Law,654,670,8.3,8.8,7.4,8.4,8.6,7.8,8.8
"George Group Of Colleges, Kolkata",West Bengal,Law,654,670,7.8,8.7,6.4,8.6,8,7.5,7.5
"Jalpaiguri Law College, Jalpaiguri",West Bengal,Law,654,670,8,8.8,7.6,8.7,7.6,7.4,8.1
Maulana Abul Kalam Azad University Of Technology,West Bengal,Law,654,670,7.7,8.1,6.9,8,7.8,7.7,7.6
Bimal Chandra College Of Law,West Bengal,Law,654,670,7.2,8,7,8,7,6,7
"Amity University, Kolkata",West Bengal,Law,654,670,8.2,8.1,7.7,8.4,8.8,7.4,8.5
"Midnapore Law College, Midnapore",West Bengal,Law,654,670,7.8,8.3,6.8,8.8,8,7.3,7.8
"Adamas University, Kolkata",West Bengal,Law,654,670,8.2,8.3,7.5,8.5,9,7.8,7.8
Jyotirmoy School Of Law,West Bengal,Law,654,670,8.9,9,9,9,8.5,8.6,9.2
Sister Nivedita University,West Bengal,Law,654,670,8.2,8.2,7.6,8.9,7.9,7.8,8.7
"Techno India University, Kolkata",West Bengal,Law,654,670,8,8.2,7.4,8.2,8.1,7.8,8.4
Seacom Skills University,West Bengal,Law,654,670,7.5,8.4,6.4,8.9,7.4,6.7,7.3
University Of Engineering And Management,West Bengal,Law,654,670,8.1,8.6,7.2,8.5,7.9,8.8,7.7
The Neotia University,West Bengal,Law,654,670,8.2,8.7,7.5,8.5,8.2,7.8,8.6
"Jis University, Kolkata",West Bengal,Law,654,670,8,8.3,7.7,8,8.2,7.8,7.8
Ias Academy,West Bengal,Law,654,670,7.9,8.2,8,8,7.8,7.6,7.8
Institute Of International Trade,West Bengal,Law,654,670,7.9,8.2,7.6,7.8,7.8,8,7.8
"Basanti Devi College, Kolkata",West Bengal,Law,654,670,7.6,8.2,6.2,8.3,7.7,6.7,8.2
"St. Peter'S College, Kolkata",West Bengal,Law,654,670,7,7.1,6.8,6.8,6.7,7.2,7.5
"Balurghat Law College, Dakshin Dinajpur",West Bengal,Law,654,670,7.2,8,6,8,6,8,7
"Bikash Bharati Law College, South 24 Parganas",West Bengal,Law,654,670,6.8,8,7,8,7,5,6
"Durgapur Institute Of Legal Studies, Bardhaman",West Bengal,Law,654,670,8.1,8.8,7.2,8.6,8.2,6.6,9
National Law University Odisha,Orissa,Law,654,670,8.8,9,8.8,8.8,8.5,8.8,8.8
Kiit School Of Law,Orissa,Law,654,670,7.6,7.7,7.2,7.7,8.4,6.5,8.1
Siksha 'O' Anusandhan University,Orissa,Law,654,670,8.3,8.6,7.6,8.3,8.7,8,8.5
"Dhenkanal Law College, Dhenkanal",Orissa,Law,654,670,7.6,8,7.5,8.5,8,6.5,7
"University Law College, Bhubaneswar",Orissa,Law,654,670,7.8,8.8,6.1,8.4,7.4,7.9,8.3
"Madhusudan Law College, Cuttack",Orissa,Law,654,670,6.8,8.4,4.5,8,6.6,5.1,8.2
"Ganjam Law College, Berhampur",Orissa,Law,654,670,8.5,9,8,9,8,8,9
Sri Sri University,Orissa,Law,654,670,7.1,7.3,6.7,7,7.3,6.3,8.2
"Baji Rout Memorial College, Bhubaneswar",Orissa,Law,654,670,6.9,8.3,5,8.7,7.3,5,7
"Berhampur University, Berhampur",Orissa,Law,654,670,7.7,8.4,7.4,8.2,7.2,6.4,8.3
Fakir Mohan University,Orissa,Law,654,670,7.8,8.7,7.6,8.5,8,5.8,8.3
North Orissa University,Orissa,Law,654,670,7.7,7.8,7.6,8.3,7.2,7.3,8.1
"Sambalpur University, Sambalpur",Orissa,Law,654,670,7.2,7.9,7.4,7.8,7.5,5.5,7
"Utkal University, Bhubaneswar",Orissa,Law,654,670,7.5,7.9,7.1,7.8,7.4,6.6,7.9
"Berhampur University, Harihar Mardaraj Distance Education Centre",Orissa,Law,654,670,8.8,8.2,7.4,8.2,8,7.5,8.1
Odisha State Open University,Orissa,Law,654,670,7.5,8.1,7.2,8.1,8,6.7,7.1
Ims Unison University,Uttarakhand,Law,654,670,8.2,8.2,8,8.5,8.5,7.5,8.2
"Icfai University, Dehradun",Uttarakhand,Law,654,670,7.8,8.2,7.5,8.2,7.4,7.3,7.9
Law College Dehradun,Uttarakhand,Law,654,670,7.7,8.5,6.7,8.6,7.7,6.4,8.3
University Of Petroleum And Energy Studies,Uttarakhand,Law,654,670,8.1,8.1,7.8,7.9,8.6,7.7,8.2
"Motherhood University, Roorkee",Uttarakhand,Law,654,670,8,8.3,7.9,7.6,8,8,8.3
"Uttaranchal University, Dehradun",Uttarakhand,Law,654,670,7.5,7.8,6.8,7.7,8.6,6.5,7.5
Graphic Era Hill University,Uttarakhand,Law,654,670,8.1,7.9,7.8,8.1,8.4,7.7,8.4
Himgiri Zee University,Uttarakhand,Law,654,670,7.9,8.5,5.5,9,8,7.7,8.8
Bfit Group Of Institutions,Uttarakhand,Law,654,670,7.5,7.7,7.1,7.7,7.6,7.1,8
"Pal College Of Technology And Management, Haldwani",Uttarakhand,Law,654,670,8.2,8.3,8.3,8.2,8.3,7.7,8.3
Amrapali Institute Of Applied Sciences,Uttarakhand,Law,654,670,7.7,7,7.3,8.3,8,7,8.3
"B.S.M. Law College, Nainital",Uttarakhand,Law,654,670,7.9,8.2,7.4,8.2,8,7.5,8.1
"Bishamber Sahai Law Instititue, Roorkee",Uttarakhand,Law,654,670,7.9,8.2,7.4,8.2,8,7.5,8.1
"Chanakya Law College, Udham Singh Nagar",Uttarakhand,Law,654,670,9.5,9.5,9.5,9.5,9,9.5,8.1
"Dav Pg College, Dehradun",Uttarakhand,Law,654,670,6.3,7.4,5.5,7.4,6.5,4.3,6.9
"Jagran School Of Law, Dehradun",Uttarakhand,Law,654,670,8.1,7.5,8.5,8,8.5,7.5,8.5
"Libra College Of Law, Dehradun",Uttarakhand,Law,654,670,7.9,8.2,7.4,8.2,8,7.5,8.1
Siddhartha Law College,Uttarakhand,Law,654,670,8.2,8.8,8,8,8.5,8,8
"Unity Law College, Rudra Pur",Uttarakhand,Law,654,670,8.2,8.5,7.5,7.8,9,8.5,7.7
"Hemwati Nandan Bahuguna Garhwal University, Garhwal",Uttarakhand,Law,654,670,7.4,7.7,6.9,7.7,8.1,6,7.9
Kumaun University,Uttarakhand,Law,654,670,6.5,7.2,5.8,7.7,6.7,4.3,7.3
"Kumaun University Ssj Campus, Almora",Uttarakhand,Law,654,670,6.1,6.9,5.9,6.8,7.3,3.4,6
Uttarakhand Open University,Uttarakhand,Law,654,670,6.8,6.9,5.3,8,6.3,6.8,7.2
"Uttarakhand Technical University, Dehradun",Uttarakhand,Law,654,670,8.6,8.9,8.2,8.8,8.7,8.4,8.7
"Graphic Era Hill University Dehradun Campus, School",Uttarakhand,Law,654,670,7.9,8.2,7.4,8.2,8,7.5,8.1
"Upes, School Of Law, Dehradun",Uttarakhand,Law,654,670,9,9.8,9,8.2,9,8.3,8.1
"Uihmt Group Of Colleges, Dehradun",Uttarakhand,Law,654,670,7.9,8.2,7.4,8.2,8,7.5,8.1
International Maritime Business Academy,Uttarakhand,Law,654,670,7.9,8.2,7.4,8.2,8,7.5,8.1
"Nef Law College, Guwahati",Assam,Law,654,670,5.1,6.9,2.8,7.1,5.8,3.3,4.9
"Dibrugarh University, Dibrugarh",Assam,Law,654,670,7.8,7.9,7.7,8,8.4,6.5,8.2
Tezpur University,Assam,Law,654,670,8,8.2,8,7.9,8.8,6.7,8.5
Royal Global University,Assam,Law,654,670,7.6,7.8,6.6,8,9,6.5,7.7
"Mangaldai Law College, Marigaon",Assam,Law,654,670,7.9,8.2,7.4,8.2,8,7.5,8.1
"Tezpur Law College, Sonitpur",Assam,Law,654,670,8.1,8.3,7.7,8.3,7.7,8,8.3
"Jorhat Law College, Jorhat",Assam,Law,654,670,6.7,7.3,6.3,7,7,6.3,6
Gauhati University,Assam,Law,654,670,8.2,8.4,7.5,8.7,8.4,7.2,8.7
Nerim Group Of Institutions,Assam,Law,654,670,7.1,7.7,6.1,7.5,7.8,6.9,6.6
Assam Rajiv Gandhi University Of Cooperative Management,Assam,Law,654,670,8.4,9,7.5,9,8.5,8,8.5
"Digboi College, Dibrugarh",Assam,Law,654,670,7.9,8.3,7.4,8.5,7.9,7.2,8.1
"Dispur Law College, Guwahati",Assam,Law,654,670,6.1,6.8,6,7,6.2,4.4,6.4
"Jb Law College, Guwahati",Assam,Law,654,670,8,8.3,7,8.5,8.3,7.7,8.1
"Assam University, Silchar",Assam,Law,654,670,7.5,7.8,6.5,8,7.6,6.6,8.4
National Law University And Judicial Academy,Assam,Law,654,670,7.3,7.8,7,7.2,8.8,5.4,7.4
"Pub Kamrup College, Kamrup",Assam,Law,654,670,7.4,8,6.3,8.2,8.5,5.4,8
"North Lakhimpur College, Lakhimpur",Assam,Law,654,670,7,7.7,6.5,7.3,7.6,5.4,7.4
"Mahapurusha Srimanta Sankaradeva Viswavidyalaya, Nagaon",Assam,Law,654,670,7.9,8.2,7.4,8.2,8,7.5,8.1
"Braja Mohan Thakur Law College (Autonomous), Purnea",Bihar,Law,654,670,7.9,8.2,7.4,8.2,8,7.5,8.1
Tilka Manjhi Bhagalpur University,Bihar,Law,654,670,7.5,7.7,6.8,8.1,7.6,6.4,8.1
Magadh University,Bihar,Law,654,670,6,7.1,5,6.9,6.4,4.7,5.8
Bihar Institute Of Law,Bihar,Law,654,670,7.7,8,7,8,7,8,8
"S.K.J. Law College, Muzaffarpur",Bihar,Law,654,670,7.5,8,7,7.8,7,7.2,7.8
"Amity University, Patna",Bihar,Law,654,670,7.8,8.5,7.2,7.8,7.7,7.8,7.9
"College Of Commerce, Arts & Science, Patna",Bihar,Law,654,670,6.9,7.9,4.7,8.1,7.6,5.6,7.3
Patna University,Bihar,Law,654,670,7,7.6,6.2,8.2,7.3,5.1,7.4
Gopal Narayan Singh University,Bihar,Law,654,670,8.5,8.6,8.6,8.2,8.9,8.1,8.4
Nalanda Open University,Bihar,Law,654,670,7.3,9,5.8,8.3,7.2,5.4,7.8
"Gdm College, Harnaut",Bihar,Law,654,670,6.7,8,2,7,8,7.5,8.1
"H.D. Jain College, Arrah",Bihar,Law,654,670,7,8.1,5.7,7.7,6.7,6.4,7.1
"M.V. College, Buxar",Bihar,Law,654,670,6.5,6.3,4.8,7.9,6.8,5.5,7.7
"Munshi Singh College, Motihari",Bihar,Law,654,670,6.7,6,6,9.3,6.3,3.8,8.7
"Nawada Vidhi Mahavidyalaya, Nawada",Bihar,Law,654,670,7.9,8.2,7.4,8.2,8,7.5,8.1
"Patna Law College, Patna",Bihar,Law,654,670,8.1,8.5,8,8.2,8.1,7.9,7.9
Br Ambedkar Bihar University,Bihar,Law,654,670,7.7,7.9,7.5,8.1,7.6,7.2,8.1
Chanakya National Law University,Bihar,Law,654,670,6.3,6.6,6.4,6.2,6.3,5.1,7.3
"Jai Prakash University, Chapra",Bihar,Law,654,670,7.7,7.8,7.2,8.3,7.6,7.6,7.9
Central University Of South Bihar,Bihar,Law,654,670,8,8.6,7.7,8.9,8.6,5.8,8.3
"T.N.B. Law College, Bhagalpur",Bihar,Law,654,670,7.6,8,7,8,7,7.5,8
"Patliputra University, Patna",Bihar,Law,654,670,7.7,7.8,7.4,8.3,7.7,7,7.7
"K.K. University, Nalanda",Bihar,Law,654,670,8.6,7,7.4,8.2,8,7.5,8.1
"Purnea University, Purnahiya",Bihar,Law,654,670,7.9,8.2,7.4,8.2,8,7.5,8.1
Hidayatullah National Law University,Chhattisgarh,Law,654,670,7.3,7.7,6.3,6.1,8,7.1,8.6
Dr. C.V. Raman University,Chhattisgarh,Law,654,670,7,6.9,6.2,7.4,7.5,6.7,7.3
Pt. Ravishankar Shukla University,Chhattisgarh,Law,654,670,6.1,7,4.8,6.8,6.8,4.1,6.8
"Amity University, Raipur",Chhattisgarh,Law,654,670,7.8,7.8,8.3,8,8,6.3,8.2
"Itm University, Raipur",Chhattisgarh,Law,654,670,7.4,8,6.4,7,8.3,7.2,7.6
Shri Rawatpura Sarkar University,Chhattisgarh,Law,654,670,8.5,9,8,8.5,8.5,8.5,8.5
"Isbm University, Raipur",Chhattisgarh,Law,654,670,7.9,8.2,7.4,8.2,8,7.5,8.1
"D.P. Vipra Law College , Bilaspur",Chhattisgarh,Law,654,670,6.5,8,4,6,6,5,8.1
Chhattisgarh University,Chhattisgarh,Law,654,670,7.7,8,7.5,8,7,8,7.5
Guru Ghasidas Vishwavidyalaya,Chhattisgarh,Law,654,670,6.7,7.6,6.3,7.5,6.9,4.7,7.1
Pandit Sundarlal Sharma Open University,Chhattisgarh,Law,654,670,7.4,8,6,8.2,8,6.9,7.4
"Sarguja University, Surguja",Chhattisgarh,Law,654,670,7.5,7.7,6.7,8,7,7.5,8.2
"Mats School Of Law, Raipur",Chhattisgarh,Law,654,670,7.9,8.3,7.3,8,8.4,8.1,7.5
"Kalinga University, Raipur",Chhattisgarh,Law,654,670,8.3,8.6,8.1,8.6,8.4,7.6,8.2
"Govt. T.C.L. College, Janjgir",Chhattisgarh,Law,654,670,7.9,8.2,7.4,8.2,8,7.5,8.1
"Ranchi University, Ranchi",Jharkhand,Law,654,670,7.5,7.9,6.8,8,8.3,6.2,7.8
Chotanagpur Law College,Jharkhand,Law,654,670,8.3,8.5,8,8.5,8,8.5,8.5
Central University Of Jharkhand,Jharkhand,Law,654,670,7.5,8.3,7.5,8.5,7.2,5.3,8.1
"Rkdf University, Ranchi",Jharkhand,Law,654,670,7.9,8.2,7.4,8.2,8,7.5,8.1
Jharkhand Rai University,Jharkhand,Law,654,670,7.7,8,7.5,8.8,7.3,6.9,7.8
Netaji Subhas University,Jharkhand,Law,654,670,9,9.5,9.4,8.7,9.2,8.5,8.7
"Sai Nath University, Ranchi",Jharkhand,Law,654,670,6.8,7.4,6.7,6.8,6.9,6.9,6.3
Radha Govind University,Jharkhand,Law,654,670,8.6,8.9,8,8.7,8.9,8.4,8.5
"Arka Jain University, Jamshedpur",Jharkhand,Law,654,670,8.1,8.1,7.7,8.1,8,7.5,9
"Amity University, Ranchi",Jharkhand,Law,654,670,7.8,8.2,7.5,8.5,7.2,7,8.2
"Icfai University, Ranchi",Jharkhand,Law,654,670,7.2,7.8,6.1,8.6,6.4,6.7,7.4
Sarala Birla University,Jharkhand,Law,654,670,8.5,8.6,8.3,8.4,8.8,8.4,8.2
"Coxtan Administrative & Management College, Dhanbad",Jharkhand,Law,654,670,7.9,8.2,7.4,8.2,8,7.5,8.1
"Jamshedpur Women'S College, Jamshedpur",Jharkhand,Law,654,670,7.4,7.8,7.4,7.6,7.3,7.2,6.9
Jharkhand Vidhi Mahavidyalaya,Jharkhand,Law,654,670,7.9,8.2,7.4,8.2,8,7.5,8.1
"Kolhan University, Chaibasa",Jharkhand,Law,654,670,7.3,7.4,6.7,8.1,6.7,6.9,7.7
National University Of Study And Research In,Jharkhand,Law,654,670,7.4,7.8,7.7,7.1,6.4,7.3,8
Sido Kanhu Murmu University,Jharkhand,Law,654,670,7.4,7.7,6.6,7.9,7.1,7.1,8
Vinoba Bhave University,Jharkhand,Law,654,670,7.2,7.4,6.4,8,7.4,6.2,7.6
"Dr. Shyama Prasad Mukherjee University, Ranchi",Jharkhand,Law,654,670,6.5,7.2,5.2,6.8,6.9,6,7.1
Binod Bihar Mahto Koylanchal University,Jharkhand,Law,654,670,8.3,8.7,7.9,8.3,8.6,7.5,8.5
Maharishi Markandeshwar,Himachal Pradesh,Law,654,670,8.6,9,8.2,8.9,8.2,8.4,8.9
Iec University Baddi,Himachal Pradesh,Law,654,670,7.6,7.5,7.5,7.4,7.7,8,7.5
Career Point University,Himachal Pradesh,Law,654,670,7.5,7.5,7.4,7,7.6,6.6,8.6
Bahra University,Himachal Pradesh,Law,654,670,7.6,7.8,7.5,8,7.7,7,7.6
"Ap Goyal Shimla University, Shimla",Himachal Pradesh,Law,654,670,7.4,7,6.8,7.7,8,7.5,7.3
Maharaja Agrasen University,Himachal Pradesh,Law,654,670,7.5,7.7,7.5,7.6,8.7,7,6.2
"Icfai University, Baddi",Himachal Pradesh,Law,654,670,8,9,7,8,8,8,8
Himachal Institute Of Engineering And Technology,Himachal Pradesh,Law,654,670,7.5,8.7,6.2,7.8,7.4,6.6,8
"Himalayan Group Of Professional Institutions, Sirmaur",Himachal Pradesh,Law,654,670,8.2,8.4,7.6,8.4,8.4,8.2,8
Manav Bharti University,Himachal Pradesh,Law,654,670,6.2,5.3,4.7,6.7,7,6.3,7
"Lr Institute Of Legal Studies, Solan",Himachal Pradesh,Law,654,670,7.9,8.2,7.4,8.2,8,7.5,8.1
Himachal Pradesh University,Himachal Pradesh,Law,654,670,7.2,7.7,6.7,7.7,7.3,6.1,7.7
International Centre For Distance Education And Open,Himachal Pradesh,Law,654,670,7.9,8.2,7.4,8.2,8,7.5,8.1
"Faculty Of Legal Sciences, Shoolini University, Solan",Himachal Pradesh,Law,654,670,9.5,8.2,7.4,8.2,8,7.5,8.1
Himachal Pradesh National Law University,Himachal Pradesh,Law,654,670,6.7,7.3,5.4,8.1,4.6,7.2,7.4
"Sheds College Of Hospitality Management, Solan",Himachal Pradesh,Law,654,670,7.9,8.2,7.4,8.2,8,7.5,8.1
"Lr Group Of Institutes, Solan",Himachal Pradesh,Law,654,670,7.9,8.2,7.4,8.2,8,7.5,8.1
"University Of Jammu, Jammu",Jammu,Law,654,670,6.6,7.5,6.8,7.4,7.6,4.9,5.6
"Dogra Law College, Jammu",Jammu,Law,654,670,8.3,8.5,8,9.8,8,6,9.5
"Ashoka Law College, Kathua",Jammu,Law,654,670,7.9,8.2,7.4,8.2,8,7.5,8.1
"Bhargava Law College, Jammu",Jammu,Law,654,670,7.9,8.2,7.4,8.2,8,7.5,8.1
"Kc Law College, Jammu",Jammu,Law,654,670,7.9,8.8,7,8.4,7.6,8.1,7.6
"Kashmir Law College, Srinagar",Jammu,Law,654,670,8.8,9,8.3,9.3,9,8.7,8.7
Kashmir Creative Education Foundation,Jammu,Law,654,670,7.9,8.2,7.4,8.2,8,7.5,8.1
Central University Of Kashmir,Jammu,Law,654,670,7.8,8.2,7.8,8.4,7.2,7.4,7.6
University Of Kashmir,Jammu,Law,654,670,6.7,7,6.9,7.1,7.2,5.1,6.8
"Directorate Of Distance Education, University Of Kashmir,",Jammu,Law,654,670,7.9,8.2,7.4,8.2,8,7.5,8.1
"Department Of Laws Panjab University, Chandigarh",Chandigarh,Law,654,670,7.9,8.2,7.4,8.2,8,7.5,8.1
Panjab University,Chandigarh,Law,654,670,7.7,8.2,7.7,8,7.7,6.5,8.2
"University Institute Of Legal Studies, Panjab University,",Chandigarh,Law,654,670,7.7,8.6,7,8.4,7.4,6.5,8.3
Goswami Ganesh Dutt Sanatan Dharama College,Chandigarh,Law,654,670,8.1,8.6,7.6,8.5,8.1,7.1,8.8
"University Institute Of Legal Studies, Chandigarh University",Chandigarh,Law,654,670,9.1,9.4,8.9,9.3,9.1,8.3,9.6
"Pg Government College For Girls, Chandigarh",Chandigarh,Law,654,670,8.1,7.7,7.4,8.9,8.3,8.2,8
"Vm Salgaocar College Of Law, Panji",Goa,Law,654,670,8,8,8.2,8.1,7.9,7.6,8.4
"Govind Ramnath Kare College Of Law, South Goa",Goa,Law,654,670,5.8,8,6,5,8,4,3.5
"Goa University, North Goa",Goa,Law,654,670,7.9,8.6,7.4,7.8,7.7,8,7.6
"Arunodaya University, Itanagar",Arunachal Pradesh,Law,654,670,8.4,9,8.5,8.2,9,7.5,7.9
Himalayan University,Arunachal Pradesh,Law,654,670,8.6,8.6,8,8.9,9.1,8.1,9
Apex Professional University,Arunachal Pradesh,Law,654,670,7.4,7.5,7.5,7.5,7.5,7.5,7
Arunachal University Of Studies,Arunachal Pradesh,Law,654,670,8.3,8.7,7.9,8.4,8.1,8.2,8.4
North East Frontier Technical University,Arunachal Pradesh,Law,654,670,8.3,9,7.6,8.5,8.2,8.7,8
"Indira Gandhi Technological And Medical Sciences University, Ziro",Arunachal Pradesh,Law,654,670,7.9,8.2,7.4,8.2,8,7.5,8.1
"The Global University, Itanagar",Arunachal Pradesh,Law,654,670,7.9,8.2,7.4,8.2,8,7.5,8.1
"Cmj University, Ri-Bhoi",Meghalaya,Law,654,670,8.3,8.8,7.8,8.5,7.8,8.2,8.6
North-Eastern Hill University,Meghalaya,Law,654,670,7.9,7.9,7.8,8.2,8.4,6.6,8.2
University Of Science And Technology,Meghalaya,Law,654,670,8.4,8.7,8.1,8.7,8.5,7.9,8.5
Mahatma Gandhi University,Meghalaya,Law,654,670,8.1,9,7,9,9,6.3,8.4
"Nagaland University, Zunhebotto",Nagaland,Law,654,670,8.1,8.1,7.7,8.7,7.8,7.8,8.3
The Global Open University,Nagaland,Law,654,670,7.8,8.9,7.3,8.4,7.6,7.3,7.4
Pondicherry University,Puducherry,Law,654,670,7.8,8,7.3,8,8.1,6.9,8.4
"Dr. B.R. Ambedkar Government Law College, Pondicherry",Puducherry,Law,654,670,4.2,5,4,4,5,3,4
"Icfai University, West Tripura",Tripura,Law,654,670,8,8.1,7.6,8.1,8.3,7.6,8.5
"Tripura University, West Tripura",Tripura,Law,654,670,7.5,8,7.1,8.4,7.6,6,8
"Icfai University, Gangtok",Sikkim,Law,654,670,6.8,6.7,6.8,7,6.7,7,6.6
"Sikkim University, Gangtok",Sikkim,Law,654,670,8.4,9,8.3,8.9,7.4,8.1,8.5
Manipur University,Manipur,Law,654,670,8.1,8.4,8.2,8.5,7.7,7.2,8.4
"Dhanamanjuri University, Imphal",Manipur,Law,654,670,6.9,7.5,8,7,7,5,8.1
"Bir Tikendrajit University, Imphal",Manipur,Law,654,670,7.9,8.2,7.4,8.2,8,7.5,8.1
"Government Mizoram Law College, Aizawl",Mizoram,Law,654,670,7.9,8.2,7.4,8.2,8,7.5,8.1
