College_Name,State,Stream,UG_fee,PG_fee,Rating,Academic,Accommodation,Faculty,Infrastructure,Placement,Social_Life
Jaipur National University,Rajasthan,Medical,654,670,7.5,7.9,7,7.7,7.8,6.7,7.6
Manipal University,Rajasthan,Medical,654,670,8.4,8.2,8.3,8.2,9.2,7.7,9
"Tantia University, Sriganganagar",Rajasthan,Medical,654,670,8.6,8.8,8.4,9.3,8.8,7.1,9.1
Jecrc University,Rajasthan,Medical,654,670,8.1,8.1,7.4,8.2,8.2,8.1,8.7
Sunrise University,Rajasthan,Medical,654,670,8.1,8.1,7.3,8.7,8.1,7.9,8.4
"Opjs University, Churu",Rajasthan,Medical,654,670,7.2,7.1,7.6,7.6,7.7,6.3,6.8
Geetanjali University,Rajasthan,Medical,654,670,7.3,7.2,6.9,7.3,8.1,7,7.1
Poornima University,Rajasthan,Medical,654,670,7.9,8.2,7.4,8,7.9,7.9,7.7
"Mody University, Sikar",Rajasthan,Medical,654,670,8.3,8.3,8.5,8,9,7.9,8.2
Jayoti Vidyapeeth Women'S University,Rajasthan,Medical,654,670,7.6,7.7,8.4,7.9,7.7,6.4,7.4
"Apex University, Jaipur",Rajasthan,Medical,654,670,8.7,8.9,8.9,8.6,8.7,8.5,8.7
Suresh Gyan Vihar University,Rajasthan,Medical,654,670,7.5,7.8,6.7,7.5,8.8,6.3,8
"Jagannath University, Jaipur",Rajasthan,Medical,654,670,7.3,7.1,6.7,7.9,7.7,6.9,7.4
"Pacific University, Udaipur",Rajasthan,Medical,654,670,7.7,7.8,7.3,8.1,7.8,7.2,8
Post Graduate Institute Of Medical Education &,Haryana,Medical,654,670,8,8.3,6.8,8.8,8.2,8,8
Government Medical College And Hospital,Haryana,Medical,654,670,7.9,8.7,7,8.5,8.2,6.9,8.3
Pt Bhagwat Dayal Sharma Post Graduate Institute,Haryana,Medical,654,670,7.5,8.4,7.5,8.1,7.5,7.6,6.1
Panjab University,Haryana,Medical,654,670,7.7,8.2,7.7,8,7.7,6.5,8.2
Maharshi Dayanand University,Haryana,Medical,654,670,7.8,8,7.7,8,8.4,6.6,8
Chandigarh University,Haryana,Medical,654,670,8.6,8.6,8.2,8.4,9,8.6,8.8
"Lord Shiva College Of Pharmacy, Sirsa",Haryana,Medical,654,670,7.9,8.3,8,8,8.3,8,7
Apeejay Stya University,Haryana,Medical,654,670,7.9,8.2,7.5,7.9,7.5,7.7,8.3
"Sri Guru Gobind Singh College Of Pharmacy,",Haryana,Medical,654,670,8.8,9.3,8.3,9.7,8.3,7.7,9.3
Kurukshetra University,Haryana,Medical,654,670,7.5,8.1,7,8,7.7,6.5,7.7
Guru Jambheshwar University Of Science And Technology,Haryana,Medical,654,670,7.7,7.7,7.3,7.5,8.9,6.5,8
Maharishi Markandeshwar,Haryana,Medical,654,670,7.5,7.6,7.2,7.7,8.3,6.8,7.6
Dav College,Haryana,Medical,654,670,8,8.4,7.4,8.3,8,6.8,8.8
Goswami Ganesh Dutt Sanatan Dharama College,Haryana,Medical,654,670,8.1,8.6,7.6,8.5,8.1,7.1,8.8
"Ashoka University, Sonepat",Haryana,Medical,654,670,8.6,8.6,8.6,8.9,8.7,8.3,8.5
"Gurugram University, Gurgaon",Haryana,Medical,654,670,8.2,8.6,7.4,8.4,8.6,8,8.1
"Pdm University, Bahadurgarh, Bahadurgarh",Haryana,Medical,654,670,7.4,7.1,7.6,7.4,7.5,7.1,7.7
"Amity University, Gurgaon",Haryana,Medical,654,670,7.7,7.8,7.1,7.6,8.6,7.1,8.1
Manav Rachna International Institute Of Research And,Haryana,Medical,654,670,7.5,7.4,7.3,7.5,8.3,6.6,7.6
"Starex University, Gurgaon",Haryana,Medical,654,670,8.8,9.1,9.1,8.7,8.6,8.5,8.7
Modern Vidya Niketan,Haryana,Medical,654,670,7,7.2,6.4,7.7,7,6.8,6.8
"Lingaya'S Vidyapeeth, Faridabad",Haryana,Medical,654,670,7.8,8,7.5,8.1,7.7,7.3,8.1
Manav Rachna University,Haryana,Medical,654,670,7.8,7.6,7.5,7.7,8.8,7.3,7.9
"Sushant University / Ansal University, Gurgaon",Haryana,Medical,654,670,7.8,8,8,7.9,8.4,7,7.5
G D Goenka University,Haryana,Medical,654,670,8.2,7.7,8.3,8.3,8.9,7.6,8.4
"Jagannath University, Bahadurgarh",Haryana,Medical,654,670,8,8.3,8,7.8,8.7,7.4,7.9
Al-Falah University,Haryana,Medical,654,670,5.6,5.9,6,6.4,6.2,4,5.1
"Sgt University, Gurgaon",Haryana,Medical,654,670,8,8,7.6,8.1,8.4,7.5,8.1
Rp Inderaprastha Institute Of Technology,Haryana,Medical,654,670,7.1,7.7,6.5,7.5,7.6,6.1,6.9
B. J. Medical College,Gujarat,Medical,654,670,8.6,9,8.3,8.5,8.1,9.3,8.3
Indian Institute Of Technology,Gujarat,Medical,654,670,8.4,8.3,8.4,8.8,9.1,7.2,8.8
National Institute Of Pharmaceutical Education And Research,Gujarat,Medical,654,670,7.5,7.7,6.7,7.7,8,7.3,7.8
"Karnavati School Of Dentistry, Karnavati University",Gujarat,Medical,654,670,9.1,9.7,8,8.7,8,7.5,8.1
Maharaja Sayajirao University Of Baroda,Gujarat,Medical,654,670,7.9,8.3,7,8.4,8,7.2,8.4
"Government Medical College, Surat",Gujarat,Medical,654,670,7.8,8.1,7.2,7.7,7.1,8.4,8.1
"Smt. Nhl Municipal Medical College, Ahmedabad",Gujarat,Medical,654,670,7.7,8.4,7.4,8.2,6.3,8.4,7.4
Pandit Deendayal Upadhyay Medical College,Gujarat,Medical,654,670,8.3,9,8,8.4,8,8.7,7.6
C. U. Shah Medical College,Gujarat,Medical,654,670,6.7,7.1,6.1,8,6.6,5.6,6.6
Pramukhswami Medical College,Gujarat,Medical,654,670,8,8.7,6.2,8.8,8.3,8,8
"Gcs Medical College, Hospital & Research Centre,",Gujarat,Medical,654,670,8.1,8.5,7.3,8.5,8.5,7.8,7.9
Smt. B.K. Shah Medical Institute And Research,Gujarat,Medical,654,670,7.1,7.7,6,7.8,5.7,7.8,7.7
Dr Babasaheb Ambedkar Open University,Gujarat,Medical,654,670,7.7,8.5,5.5,8.5,8,7.5,8.1
Sardar Patel University,Gujarat,Medical,654,670,7.8,8.6,7,8.5,7.7,7.3,7.8
"Navsari Agricultural University, Navsari",Gujarat,Medical,654,670,8,8.3,7.4,8.4,7.8,7.8,8.2
Gujarat Vidyapith,Gujarat,Medical,654,670,8.4,9,7.9,9.1,8.4,7.6,8.1
Karnavati University,Gujarat,Medical,654,670,8.9,8.6,8.2,9.3,9.4,8.6,9.3
"Sumandeep Vidyapeeth, Vadodara",Gujarat,Medical,654,670,7.8,8,7,8.2,8,7.5,8
"Atmiya University, Rajkot",Gujarat,Medical,654,670,8.1,8.8,7.5,8.6,8.4,7.4,7.9
Ganpat University,Gujarat,Medical,654,670,8.1,8.2,7.2,8.1,8.5,7.8,8.6
"C. U. Shah University, Wadhwan",Gujarat,Medical,654,670,7.7,7.6,7,8.2,7.8,7.4,7.9
"P.P. Savani University, Surat",Gujarat,Medical,654,670,9.3,9.4,8.9,9.5,9.6,8.7,9.4
"Indus University, Ahmedabad",Gujarat,Medical,654,670,7.5,7.9,7,7.7,7.8,6.8,7.9
Marwadi University,Gujarat,Medical,654,670,8.3,8.2,8.3,8.2,9.1,7.7,8.2
"Uka Tarsadia University, Bardoli",Gujarat,Medical,654,670,8.1,7.8,7.9,8.2,9.4,6.9,8.3
Rk University,Gujarat,Medical,654,670,8.5,9,7.9,8.6,9,7.8,8.5
Dharmsinh Desai University,Gujarat,Medical,654,670,7.7,8.5,7,8.3,7.1,8.1,6.9
Itm Vocational University,Gujarat,Medical,654,670,7.8,8.7,7.4,8,7.5,7.1,7.9
Charotar University Of Science And Technology,Gujarat,Medical,654,670,8.5,8.5,8,8.4,9.3,8.1,8.6
Post Graduate Institute Of Medical Education &,Punjab,Medical,654,670,8,8.3,6.8,8.8,8.2,8,8
Christian Medical College,Punjab,Medical,654,670,8.5,9,7.8,8.8,8.5,8.5,8.3
Dayanand Medical College And Hospital,Punjab,Medical,654,670,8.3,8.4,8.2,8.5,8.4,8,8.2
Government Medical College And Hospital,Punjab,Medical,654,670,7.9,8.7,7,8.5,8.2,6.9,8.3
Panjab University,Punjab,Medical,654,670,7.7,8.2,7.7,8,7.7,6.5,8.2
Sri Guru Ram Das Institute Of Dental,Punjab,Medical,654,670,5.7,7,5,7,9,1,5
"Government Medical College / Rajindra Hospital-[Gmcp], Patiala",Punjab,Medical,654,670,7.5,7.3,7.3,8.3,6.5,7.8,7.5
Chandigarh University,Punjab,Medical,654,670,8.6,8.6,8.2,8.4,9,8.6,8.8
"Sri Guru Gobind Singh College Of Pharmacy,",Punjab,Medical,654,670,8.8,9.3,8.3,9.7,8.3,7.7,9.3
"Khalsa College, Amritsar",Punjab,Medical,654,670,7.9,8.3,7.7,7.9,8.3,6.5,8.4
"Bbk Dav College For Women, Amritsar",Punjab,Medical,654,670,8.8,9,8.5,9.5,8.2,7.8,9.5
Dav College,Punjab,Medical,654,670,8,8.4,7.4,8.3,8,6.8,8.8
Goswami Ganesh Dutt Sanatan Dharama College,Punjab,Medical,654,670,8.1,8.6,7.6,8.5,8.1,7.1,8.8
"Rimt University, Gobindgarh",Punjab,Medical,654,670,7.6,7.9,7.3,7.8,8,6.7,7.8
Chitkara University,Punjab,Medical,654,670,8.5,8.4,7.7,8.5,8.9,8.7,8.7
"Guru Kashi University, Bathinda",Punjab,Medical,654,670,7.5,7.4,7.2,8,7.2,7.2,7.8
"Dav University, Jalandhar",Punjab,Medical,654,670,7.9,8.4,7,8.4,7,8,8.5
"Adesh University, Bathinda",Punjab,Medical,654,670,8.6,8.8,8.8,8.5,9,8.3,8.3
Sant Baba Bhag Singh University,Punjab,Medical,654,670,8.5,9,8.2,8.6,8,8.5,8.6
"Rayat Bahra University, Mohali",Punjab,Medical,654,670,7.7,7.8,7.4,8,7.7,7.4,7.6
"Gna University, Phagwara",Punjab,Medical,654,670,7.7,8,7.6,7.9,7.8,7.2,7.7
Sri Guru Granth Sahib World University,Punjab,Medical,654,670,8.8,8.6,9,9,9.1,8.4,8.7
Sri Guru Ram Das University Of Health,Punjab,Medical,654,670,8.8,8.7,8.7,9,9,8.4,8.8
Ct University,Punjab,Medical,654,670,8.8,8.9,8.5,8.7,9.3,8.8,8.5
"Ct Group Of Institutions, Jalandhar",Punjab,Medical,654,670,7.6,7.5,7,8.2,7.5,7.9,7.4
"Rayat Bahra Hoshiarpur Campus, Hoshiarpur",Punjab,Medical,654,670,8.9,9.2,8.5,9.2,8.3,8.8,9.1
"Rayat Bahra Patiala Campus, Patiala",Punjab,Medical,654,670,6,6.3,7.8,6,6,4,6
"Kms College Of It And Management, Dasuya",Punjab,Medical,654,670,8.2,8,8,8,9,8,8
"Sbet Institute Of Management And Technology, Mohali",Punjab,Medical,654,670,7.9,8.2,7.4,8.2,8,7.5,8.1
"Kolkata Medical College, Kolkata",West Bengal,Medical,654,670,8.1,8.7,7.3,8,7.6,9,7.7
Institute Of Post Graduate Medical Education And,West Bengal,Medical,654,670,8,8.7,7.4,7.9,8.3,8.5,7.2
R. G. Kar Medical College And Hospital,West Bengal,Medical,654,670,8.6,8.8,7.4,9,8.5,9.4,8.7
Indian Institute Of Technology,West Bengal,Medical,654,670,8.5,8.8,7.2,8.2,8.9,8.8,9
The West Bengal National University Of Juridical,West Bengal,Medical,654,670,8.5,8.6,8.2,8.7,6.8,9.2,9.4
"University Of Calcutta, Kolkata",West Bengal,Medical,654,670,7.7,8.6,6.9,8.5,7.7,6.5,7.7
"Nshm Knowledge Campus, Kolkata",West Bengal,Medical,654,670,7.8,8,6.8,8.1,8.2,7.7,8
Nilratan Sircar Medical College & Hospital,West Bengal,Medical,654,670,8.1,8.1,7.3,7.8,7.9,9.1,8.1
"Annex College, Kolkata",West Bengal,Medical,654,670,7.9,7.7,8.3,8.3,7.8,7.5,8
Institute Of Management Study,West Bengal,Medical,654,670,7.3,7.8,6.4,7.7,7.6,7.3,6.8
"George Group Of Colleges, Kolkata",West Bengal,Medical,654,670,7.8,8.7,6.4,8.6,8,7.5,7.5
"Techno India University, Kolkata",West Bengal,Medical,654,670,8,8.2,7.4,8.2,8.1,7.8,8.4
"Brainware University, Kolkata",West Bengal,Medical,654,670,7.9,8.3,7.6,7.9,8.2,7.8,7.3
Vidyasagar College,West Bengal,Medical,654,670,6.9,8.1,6.2,8.1,7.3,3.9,7.8
"Rammohan College, Kolkata",West Bengal,Medical,654,670,7.4,8,7.3,8.4,7,6.1,7.7
Haldia Institute Of Management,West Bengal,Medical,654,670,8,8.1,7.7,8.5,7.6,7.6,8.2
Ias Academy,West Bengal,Medical,654,670,7.9,8.2,8,8,7.8,7.6,7.8
Syamaprasad Institute Of Technology And Management,West Bengal,Medical,654,670,7.9,8.2,7.4,8.2,8,7.5,8.1
"Acharya Brojendra Nath Seal College, Cooch Behar",West Bengal,Medical,654,670,7.5,8.8,6.9,8.2,7.7,5,8.1
"Ananda Chandra College, Jalpaiguri",West Bengal,Medical,654,670,8,8.9,7.3,8,8,7.6,8.4
Ananda Mohan College,West Bengal,Medical,654,670,6.5,7,6.2,8.1,5.8,4.2,7.8
"Bajkul Milani Mahavidyalaya, Medinipur",West Bengal,Medical,654,670,7.5,7.1,7,8.3,7.3,6.9,8.1
Bankura Christian College,West Bengal,Medical,654,670,7.8,8.5,7.4,8.4,8.3,6.3,8
"Basirhat College, North 24 Parganas",West Bengal,Medical,654,670,6.9,7,6.5,7.7,7.5,5.2,7.6
"Berhampore Girls College, Murshidabad",West Bengal,Medical,654,670,7.9,8.3,7.4,8.3,7.6,7.7,8.2
"Bhairab Ganguly College, Kolkata",West Bengal,Medical,654,670,7.4,7.8,6.4,8.7,8.5,5.6,7.6
"Deshbandhu College For Girls, Kolkata",West Bengal,Medical,654,670,8.2,8.6,8.3,8.4,7.9,7.9,8
"Dr. Kanailal Bhattacharyya College, Howrah",West Bengal,Medical,654,670,7,6.5,6.8,8.1,6.2,6.8,7.6
"Garhbeta College, Medinipur",West Bengal,Medical,654,670,7,7.7,6.7,7.8,7.5,4.9,7.5
"Hiralal Mazumdar Memorial College For Women, Kolkata",West Bengal,Medical,654,670,7.9,8.2,7.4,8.2,8,7.5,8.1
Siksha 'O' Anusandhan University,Orissa,Medical,654,670,8.3,8.6,7.6,8.3,8.7,8,8.5
Kalinga Institute Of Industrial Technology,Orissa,Medical,654,670,8.6,8.4,8.1,8.2,9.2,8.6,9
Veer Surendra Sai Institute Of Medical Sciences,Orissa,Medical,654,670,8.3,8.6,8,8.3,7.9,8.8,8.3
Maharaja Krishna Chandra Gajapati Medical College And,Orissa,Medical,654,670,7.9,8.1,7.3,7.7,7.9,8.3,7.9
Bhava Institute Of Medical Science And Research,Orissa,Medical,654,670,7.9,8.2,7.4,8.2,8,7.5,8.1
Sri Sri University,Orissa,Medical,654,670,7.1,7.3,6.7,7,7.3,6.3,8.2
Centurion University Of Technology And Management,Orissa,Medical,654,670,7.4,7.7,6.8,7.8,7.8,6.6,7.8
Centurion University Of Technology And Management,Orissa,Medical,654,670,8.1,8.3,7.6,8.5,8.4,7.4,8.5
Aiph University,Orissa,Medical,654,670,8.3,8.5,7.5,8.5,8.5,8.5,8.5
"Driems Group Of Institutions, Cuttack",Orissa,Medical,654,670,7.6,8,7.2,7.2,9.2,6.9,6.8
"Hi-Tech Group Of Institutions, Bhubaneswar",Orissa,Medical,654,670,8.1,9.5,7.5,8.3,8.5,6.7,8
"Dr. Abhin Chandra Homoeopathic Medical College, Bhubaneswar",Orissa,Medical,654,670,7.7,8,8.1,7.1,8,7.1,7.6
Kalinga Institute Of Medical Sciences,Orissa,Medical,654,670,8.2,8.4,7.4,8.9,8,8.4,8.3
Swami Vivekanand National Institute Of Rehabilitation Training,Orissa,Medical,654,670,8.3,8.6,7.2,8.6,8.6,8.5,8.1
Sri Ram Chandra Bhanja Medical College And,Orissa,Medical,654,670,8.4,8.6,8.1,8.3,8.1,8.8,8.3
Lord Jagannath Mission'S College And School Of,Orissa,Medical,654,670,7.9,8.2,7.4,8.2,8,7.5,8.1
National Institute Of Medical And Management Studies,Orissa,Medical,654,670,7.9,8.2,7.4,8.2,8,7.5,8.1
All India Institute Of Medical Sciences,Orissa,Medical,654,670,8.4,8.9,7.3,8.6,8.1,8.8,8.4
Ravenshaw University,Orissa,Medical,654,670,7.8,8.1,7,8,8.5,6.9,8
"Utkal University, Bhubaneswar",Orissa,Medical,654,670,7.5,7.9,7.1,7.8,7.4,6.6,7.9
Institute Of Medical Sciences And Sum Hospital,Orissa,Medical,654,670,8.2,9,6,9.4,8.2,9.1,7.5
Asian Institute Of Public Health,Orissa,Medical,654,670,6.9,7.5,6.5,7,7,6.5,7
"Berhampur University, Harihar Mardaraj Distance Education Centre",Orissa,Medical,654,670,8.8,8.2,7.4,8.2,8,7.5,8.1
Hi-Tech Medical College And Hospital,Orissa,Medical,654,670,7.9,8.5,6.9,8.6,7.3,7.9,8.4
"Gopabandhu Ayurveda Mahavidyalaya, Puri",Orissa,Medical,654,670,7.9,8.2,7.4,8.2,8,7.5,8.1
"Sln Medical College And Hospital, Koraput",Orissa,Medical,654,670,7.2,7.7,6.7,7,7.3,7.7,6.7
Odisha State Open University,Orissa,Medical,654,670,7.5,8.1,7.2,8.1,8,6.7,7.1
"Pandit Raghunath Murmu Medical College, Mayurbhanj",Orissa,Medical,654,670,6.7,6.7,6.7,7,6,7,7
"Government Medical College And Hospital, Balasore",Orissa,Medical,654,670,8.6,8.6,8,8.3,9,9.3,8.3
Shri Guru Ram Rai Institute Of Medical,Uttarakhand,Medical,654,670,7.9,8,7.5,8.3,7.3,7.9,8.1
Greenway Institute Of Management Studies,Uttarakhand,Medical,654,670,6.1,7,5.5,6.5,6.5,4,7
University Of Petroleum And Energy Studies,Uttarakhand,Medical,654,670,8.1,8.1,7.8,7.9,8.6,7.7,8.2
Dolphin Pg Institute Of Biomedical & Natural,Uttarakhand,Medical,654,670,7.7,8.4,6.5,7.9,7.8,6.7,8.6
"Patanjali University, Haridwar",Uttarakhand,Medical,654,670,8.2,8.4,8.3,8.4,8.4,7.8,8.1
"Motherhood University, Roorkee",Uttarakhand,Medical,654,670,8,8.3,7.9,7.6,8,8,8.3
Swami Rama Himalayan University,Uttarakhand,Medical,654,670,7,7.1,6.6,6.9,7.4,7.1,6.7
Shri Guru Ram Rai University,Uttarakhand,Medical,654,670,7.6,7.8,7.1,7.9,7.9,7.3,7.7
Himgiri Zee University,Uttarakhand,Medical,654,670,7.9,8.5,5.5,9,8,7.7,8.8
Dev Bhoomi Group Of Institutions,Uttarakhand,Medical,654,670,7.8,8.1,7.1,7.8,8,8,7.8
Roorkee Institute Of Technology,Uttarakhand,Medical,654,670,8.5,8.5,8.5,8.6,8.7,8.4,8.5
Sardar Bhagwan Singh University,Uttarakhand,Medical,654,670,8.7,8.7,8.3,9.3,9,8.3,8.7
Institute Of Clinical Research,Uttarakhand,Medical,654,670,7.9,8.2,7.4,8.2,8,7.5,8.1
"Sai Group Of Institutions, Dehradun",Uttarakhand,Medical,654,670,8.8,9,8,9.3,9,9,8.7
"Pal College Of Technology And Management, Haldwani",Uttarakhand,Medical,654,670,8.2,8.3,8.3,8.2,8.3,7.7,8.3
"Beehive College Of Advanced Studies, Dehradun",Uttarakhand,Medical,654,670,7.9,8.2,7.4,8.2,8,7.5,8.1
"Sai Business And Media School, Dehradun",Uttarakhand,Medical,654,670,7.9,8.2,7.4,8.2,8,7.5,8.1
Swami Vivekanand Institute Of Management,Uttarakhand,Medical,654,670,9.2,8,7.4,8.2,8,7.5,8.1
"Dbs Pg College, Dehradun",Uttarakhand,Medical,654,670,6.9,7.8,6,8.8,5.8,4.4,8.4
"Government Degree College, Dehradun",Uttarakhand,Medical,654,670,8.6,8.2,7.4,8.2,8,7.5,8.1
"Government Girl'S Degree College, Nainital",Uttarakhand,Medical,654,670,7.9,8.2,7.4,8.2,8,7.5,8.1
"Png Government Pg College, Nainital",Uttarakhand,Medical,654,670,7.8,8.8,7,9,8,5.4,8.6
"Chandola Homoeopathic Medical College And Hospital, Udham",Uttarakhand,Medical,654,670,8.5,8.7,8,8.7,8.3,7.7,9.7
Sardar Bhagwan Singh Post Graduate Institute Of,Uttarakhand,Medical,654,670,8.2,8.3,7.6,8.8,7.9,8,8.6
Himalayan College Of Nursing,Uttarakhand,Medical,654,670,8,8,7.4,8.2,8,8,8.1
Uttaranchal College Of Technology And Biomedical Sciences,Uttarakhand,Medical,654,670,6.2,6.8,4.8,7.8,6,5.4,6.6
Jaspal Rana Institute Of Education And Technology,Uttarakhand,Medical,654,670,7.9,8.2,7.4,8.2,8,7.5,8.1
All India Institute Of Medical Sciences,Uttarakhand,Medical,654,670,9.1,9.2,8.6,9.3,9.2,9.2,8.8
Dev Sanskriti Vishwavidyalaya,Uttarakhand,Medical,654,670,9.2,9.6,9,9.3,9.1,9.1,9.3
Gauhati Medical College And Hospital,Assam,Medical,654,670,8.5,8.6,7.7,8.5,8.3,9.3,8.3
Royal Global University,Assam,Medical,654,670,7.6,7.8,6.6,8,9,6.5,7.7
Gauhati University,Assam,Medical,654,670,8.2,8.4,7.5,8.7,8.4,7.2,8.7
Assam Down Town University,Assam,Medical,654,670,8.2,8.4,7.6,8.4,8.2,7.8,8.6
"Assam Women'S University, Jorhat",Assam,Medical,654,670,7.7,8.3,7.3,8.2,6.7,7.5,8.3
Assam Govt Homoeopathic Medical College And Hospital,Assam,Medical,654,670,6,7,5,3,6,6,9
"Assam Medical College, Dibrugarh",Assam,Medical,654,670,8.8,9.3,8,8.8,8.1,9.5,8.8
Jorhat Medical College,Assam,Medical,654,670,8.1,8.3,7.8,8.3,7.9,8.2,8.1
Silchar Medical College,Assam,Medical,654,670,8.5,8.3,7.8,8.9,8.5,8.7,8.7
Army Institute Of Nursing,Assam,Medical,654,670,9.8,8.2,7.4,8.2,8,7.5,8.1
Kaziranga University,Assam,Medical,654,670,7.5,7.3,6.7,8.1,7.4,7.2,8.1
Krishna Kanta Handiqui State Open University,Assam,Medical,654,670,7.6,8.2,7.2,8.6,7.4,6.8,7.6
Fakhruddin Ali Ahmed Medical College And Hospital,Assam,Medical,654,670,8.2,8.4,7.8,8.4,8,8.8,7.8
Tezpur Medical College & Hospital,Assam,Medical,654,670,7.9,8.8,5.8,8.7,7.8,7.5,8.1
"Pub Kamrup College, Kamrup",Assam,Medical,654,670,7.4,8,6.3,8.2,8.5,5.4,8
"Krishnaguru Adhyatmik Visvavidyalaya, Barpeta",Assam,Medical,654,670,7.9,8.2,7.4,8.2,8,7.5,8.1
"Mahapurusha Srimanta Sankaradeva Viswavidyalaya, Nagaon",Assam,Medical,654,670,7.9,8.2,7.4,8.2,8,7.5,8.1
Srimanta Sankaradeva University Of Health Sciences,Assam,Medical,654,670,8.2,8.5,7.5,8.7,7.5,8.3,8.4
"Nepeds Group Of Institutions, Guwahati",Assam,Medical,654,670,7.9,8.2,7.4,8.2,8,7.5,8.1
"Pews Group Of Institutions, Guwahati",Assam,Medical,654,670,7.9,8.2,7.4,8.2,8,7.5,8.1
"Majuli University Of Culture, Majuli",Assam,Medical,654,670,7.9,8.2,7.4,8.2,8,7.5,8.1
"Nalanda Medical College, Patna",Bihar,Medical,654,670,7.7,7.8,7.1,7.8,8,8.1,7.5
Indira Gandhi Institute Of Medical Sciences,Bihar,Medical,654,670,8.7,8.8,8.6,8.3,8.7,9.3,8.3
Tilka Manjhi Bhagalpur University,Bihar,Medical,654,670,7.5,7.7,6.8,8.1,7.6,6.4,8.1
Magadh University,Bihar,Medical,654,670,6,7.1,5,6.9,6.4,4.7,5.8
Aryabhatta Knowledge University,Bihar,Medical,654,670,8,8.7,7.1,8.1,8.3,7.6,8.1
"College Of Commerce, Arts & Science, Patna",Bihar,Medical,654,670,6.9,7.9,4.7,8.1,7.6,5.6,7.3
Patna University,Bihar,Medical,654,670,7,7.6,6.2,8.2,7.3,5.1,7.4
Gopal Narayan Singh University,Bihar,Medical,654,670,8.5,8.6,8.6,8.2,8.9,8.1,8.4
Nalanda Open University,Bihar,Medical,654,670,7.3,9,5.8,8.3,7.2,5.4,7.8
"Al-Karim University, Katihar",Bihar,Medical,654,670,7.9,8.2,7.4,8.2,8,7.5,8.1
Dr. C.V. Raman University,Bihar,Medical,654,670,7.9,8.2,7.4,8.2,8,7.5,8.1
Bhuwaneshwari Dayal College,Bihar,Medical,654,670,7.2,8.2,6.3,8.4,7.6,5.3,7.1
"H.D. Jain College, Arrah",Bihar,Medical,654,670,7,8.1,5.7,7.7,6.7,6.4,7.1
"M.V. College, Buxar",Bihar,Medical,654,670,6.5,6.3,4.8,7.9,6.8,5.5,7.7
Dr Rb Singh Gaya Homoeopathic Medical College,Bihar,Medical,654,670,7.9,8.2,7.4,8.2,8,7.5,8.1
Magadh Homoeopathic Medical College,Bihar,Medical,654,670,7.9,8.2,7.4,8.2,8,7.5,8.1
Anugrah Narayan Magadh Medical College And Hospital,Bihar,Medical,654,670,7.6,7.8,7.1,8,6.2,9.2,7.5
"Darbhanga Medical College, Darbhanga",Bihar,Medical,654,670,7.3,7.3,7,7.2,6.5,8.1,7.9
Jawaharlal Nehru Medical College,Bihar,Medical,654,670,8.3,8.3,8.2,8.2,8.1,8.6,8.4
"Katihar Medical College, Katihar",Bihar,Medical,654,670,8.6,8.7,8.7,8.7,8.4,8.5,8.4
Patna Medical College,Bihar,Medical,279,279,7.4,7.8,7.2,7.8,6.2,8.6,7
"Zulfequar Haider Unani Medical College And Hospital,",Bihar,Medical,654,670,7.9,8.2,7.4,8.2,8,7.5,8.1
Bihar Institute Of Nursing And Paramedical,Bihar,Medical,654,670,7.9,8.2,7.4,8.2,8,7.5,8.1
Jm Institute Of Speech And Hearing,Bihar,Medical,654,670,7.9,8.2,7.4,8.2,8,7.5,8.1
Br Ambedkar Bihar University,Bihar,Medical,654,670,7.7,7.9,7.5,8.1,7.6,7.2,8.1
All India Institute Of Medical Sciences,Bihar,Medical,654,670,8,8.1,7.7,7.7,8.1,8.4,7.9
Lalit Narayan Mithila University,Bihar,Medical,654,670,7.9,8.6,7.8,8.6,8.6,5.9,8
Maulana Mazharul Haque Arabic And Persian University,Bihar,Medical,654,670,8.2,8.8,8.3,8.6,8.7,7.1,7.9
Vardhman Institute Of Medical Sciences,Bihar,Medical,654,670,8.8,9.1,8.4,8.7,9.1,8.9,8.4
Shri Krishna Medical College,Bihar,Medical,654,500,8.2,7,7.4,8.2,8,7.5,8.1
"Mats University, Raipur",Chhattisgarh,Medical,654,670,7.4,7.4,7,7.8,7.4,7.2,7.4
Shri Rawatpura Sarkar University,Chhattisgarh,Medical,654,670,8.5,9,8,8.5,8.5,8.5,8.5
Maharishi University Of Management And Technology Bilaspur,Chhattisgarh,Medical,654,670,6.4,7.5,7,6,7.5,5.3,5
"Isbm University, Raipur",Chhattisgarh,Medical,654,670,7.9,8.2,7.4,8.2,8,7.5,8.1
"D.L.S. P.G. College, Bilaspur",Chhattisgarh,Medical,654,670,7.9,8.2,7.4,8.2,8,7.5,8.1
All India Institute Of Medical Sciences,Chhattisgarh,Medical,654,670,8.3,8.9,7.7,8.8,8.6,8.6,7.4
"Apollo College Of Physiotherapy, Durg",Chhattisgarh,Medical,654,670,7.9,8.2,7.4,8.2,8,7.5,8.1
Chhattisgarh Institute Of Medical Sciences,Chhattisgarh,Medical,654,670,8,8.3,6.9,8.2,6.9,9,8.7
Post Graduate Institute Of Behavioral And Medical,Chhattisgarh,Medical,654,670,7.9,8.2,7.4,8.2,8,7.5,8.1
"Netaji Subhash College, Raipur",Chhattisgarh,Medical,654,670,7.9,8.2,7.4,8.2,8,7.5,8.1
Pt. Deen Dayal Upadhaya Memorial Ayush And,Chhattisgarh,Medical,654,670,7.6,7,7.5,8,7.5,8,7.5
Chhattisgarh Swami Vivekanand Technical University,Chhattisgarh,Medical,654,670,6.1,7.3,5.4,6.9,6.4,4.7,5.8
Chhattisgarh University,Chhattisgarh,Medical,654,670,7.7,8,7.5,8,7,8,7.5
Pandit Sundarlal Sharma Open University,Chhattisgarh,Medical,654,670,7.4,8,6,8.2,8,6.9,7.4
"St Vincent Pallotti College, Raipur",Chhattisgarh,Medical,654,670,7.3,8.5,5,8,7.5,6.5,8
"Dr. Cv Raman University, Institute Of Open",Chhattisgarh,Medical,654,670,6.8,7,6,7,7.5,6,7
Pt. Jawahar Lal Nehru Memorial Medical College,Chhattisgarh,Medical,654,670,8.1,8.2,7.5,8,8.2,8.7,7.7
"Late Baliram Kashyap Memorial Govt. Medical College,",Chhattisgarh,Medical,654,670,7.8,7,8,8.2,7,9,8.1
Late Shri Lakhi Ram Agrawal Memorial Government,Chhattisgarh,Medical,654,670,7,7,7,7,7.5,7,6.5
Government Medical College Rajnandgaon,Chhattisgarh,Medical,654,670,8.1,8.5,7.5,9,7.5,9.5,6.5
Government Medical College,Chhattisgarh,Medical,654,670,8,8.2,7.4,8.2,8,7.5,8.1
"Shri Narayan Prasad Awasthi Government Ayurved College,",Chhattisgarh,Medical,654,670,7.9,8.2,7.4,8.2,8,7.5,8.1
"Pt. Harishankar Shukla Memorial College, Raipur",Chhattisgarh,Medical,654,670,8.5,9,8,9,8,9,8
Hemchand Yadav Vishwavidyalaya,Chhattisgarh,Medical,654,670,7.8,7.9,7.4,8,7.6,7.7,8.2
Shri Shankaracharya Institute Of Medical Sciences,Chhattisgarh,Medical,654,670,7,7.7,6,7.7,6.7,8,5.7
Birsa Agricultural University,Jharkhand,Medical,654,670,7.3,7.6,8.3,7.2,7.6,5,8.3
"Ranchi University, Ranchi",Jharkhand,Medical,654,670,7.5,7.9,6.8,8,8.3,6.2,7.8
Central Institute Of Psychiatry,Jharkhand,Medical,654,670,6.3,8.2,7.4,7,8,4.5,7.5
Ybn University,Jharkhand,Medical,654,670,8.2,8.5,7.5,8.5,8,8.3,8.4
"Aisect University, Hazaribagh",Jharkhand,Medical,654,670,9.9,8.2,7.4,8.2,8,7.5,8.1
"Rkdf University, Ranchi",Jharkhand,Medical,654,670,7.9,8.2,7.4,8.2,8,7.5,8.1
Jharkhand Rai University,Jharkhand,Medical,654,670,7.7,8,7.5,8.8,7.3,6.9,7.8
Netaji Subhas University,Jharkhand,Medical,654,670,9,9.5,9.4,8.7,9.2,8.5,8.7
Radha Govind University,Jharkhand,Medical,654,670,8.6,8.9,8,8.7,8.9,8.4,8.5
"Arka Jain University, Jamshedpur",Jharkhand,Medical,654,670,8.1,8.1,7.7,8.1,8,7.5,9
Usha Martin University,Jharkhand,Medical,654,670,7.6,8.5,6.5,8.8,6.8,7.9,7.1
Sarala Birla University,Jharkhand,Medical,654,670,8.5,8.6,8.3,8.4,8.8,8.4,8.2
Capital University,Jharkhand,Medical,654,670,8.2,8.3,8.1,8,8.3,8.1,8.1
Ramchandra Chandravansi University,Jharkhand,Medical,654,670,5.7,7,7.4,8.2,6,4,8.1
"Coxtan Administrative & Management College, Dhanbad",Jharkhand,Medical,654,670,7.9,8.2,7.4,8.2,8,7.5,8.1
"Jamshedpur Women'S College, Jamshedpur",Jharkhand,Medical,654,670,7.4,7.8,7.4,7.6,7.3,7.2,6.9
Shine Abdur Razzaque Ansari Institute Of Health,Jharkhand,Medical,654,670,7.9,8.2,7.4,8.2,8,7.5,8.1
"Mahatma Gandhi Memorial Medical College, Jamshedpur",Jharkhand,Medical,654,670,7.6,7.6,7.9,7.3,6.8,8.3,7.6
Patliputra Medical College & Hospital,Jharkhand,Medical,654,670,8.3,8.8,8.2,8.4,7.2,9.2,8.1
Rajendra Institute Of Medical Sciences,Jharkhand,Medical,654,670,8,8.3,7.5,8.3,8.1,8.6,7.3
"Florence College Of Nursing, Ranchi",Jharkhand,Medical,654,670,7.9,8.2,7.4,8.2,8,7.5,8.1
"Kolhan University, Chaibasa",Jharkhand,Medical,654,670,7.3,7.4,6.7,8.1,6.7,6.9,7.7
"Vananchal Educational And Welfare Trust, Garhwa",Jharkhand,Medical,654,670,7.2,8,7,7,7,7,7
"Dr. Shyama Prasad Mukherjee University, Ranchi",Jharkhand,Medical,654,670,6.5,7.2,5.2,6.8,6.9,6,7.1
"Markham College Of Commerce, Hazaribagh",Jharkhand,Medical,654,670,7,6.3,6,8,6.7,7.3,7.5
"Pragyan International University, Ranchi",Jharkhand,Medical,654,670,7.9,8.2,7.4,8.2,8,7.5,8.1
Binod Bihar Mahto Koylanchal University,Jharkhand,Medical,654,670,8.3,8.7,7.9,8.3,8.6,7.5,8.5
All India Institute Of Medical Sciences,Jharkhand,Medical,654,670,7.9,8.2,7.4,8.2,8,7.5,8.1
Shrinivas Institute Of Paramedical Sciences,Jharkhand,Medical,654,670,7.9,8.2,7.4,8.2,8,7.5,8.1
Dr Rajendra Prasad Government Medical College,Himachal Pradesh,Medical,654,670,8.7,8.7,8,8.3,9,8.7,9.3
"Shoolini University, Solan",Himachal Pradesh,Medical,654,670,8.3,8.4,7.6,8.4,8.6,8.3,8.7
Maharishi Markandeshwar,Himachal Pradesh,Medical,654,670,8.6,9,8.2,8.9,8.2,8.4,8.9
Eternal University,Himachal Pradesh,Medical,654,670,7.5,7.4,7.1,7.8,8.2,7.1,7.4
